{
  "$schema": "../schema/allowlists.schema.json",
  "file_kind": "allowlists",
  "generator": "@margdarshak/content allowlists v1",
  "licence": "CC-BY-4.0",
  "inputs": {
    "catalogue/drills.json": "b1406c3c4457e386efd889a04a11671a71c9155ceb49a8917088c9e11de56670",
    "catalogue/findings.json": "e3ae81f5b3ba1ed3317e805f6f0351e31e6c4a792a647ec65f401308f7876cea",
    "catalogue/games.json": "b367b55fe34aa1deed3d8ad49bd7d5e7d82ccb035f49873e51e182088b257d31",
    "catalogue/rules.json": "01aa301f2eeae96d602aa5711730412bf39e7bee194f5dc6fcb5f90e27a046b4",
    "catalogue/signs.json": "343523693848c952602c7cfad0887c73b6021ff4db20f457e9fb992a87f7e381",
    "curriculum": "9a1002a7582c462285079c836217df3c78e50e2172848f57fe2adffa3bec4b06",
    "questions": "6660a352e570d6bc72cf94b758097594e41ecf7934b4c3139a9aa2b656df7a4b"
  },
  "policy": {
    "citable_rule": "verified && kind != 'medical'",
    "explanations": "review_status == 'approved' && hi_review_status == 'approved'",
    "drills_for_coach_and_voice": "availability == 'phase_1_2'",
    "template_only_games_excluded_from_ai": ["golden_hour"]
  },
  "debrief_agent": {
    "finding_ids": [
      "BS_LEFT_OVERTAKE",
      "BS_NOZONE_TIME",
      "BS_NO_HOLD_BACK",
      "BS_NO_MIRROR_CHECK",
      "BS_PLACEMENT_WRONG",
      "HF_ISI_CONFUSION",
      "HF_PILLION_GAP",
      "HF_STEPS_OUT_OF_ORDER",
      "HF_STRAP_STEP_SKIPPED",
      "HR_BEND_OVERTAKE",
      "HR_BRAKE_FADE",
      "HR_NO_HORN_BLIND",
      "HR_NO_YIELD_UPHILL",
      "HR_OFF_EDGE",
      "HR_STOP_UNDER_SLOPE",
      "HR_TRIP_PLAN_GAP",
      "JS_COLLISION",
      "JS_NOT_RIGHT_LAST",
      "JS_NO_CREEP",
      "JS_NO_SCAN_THREAT_SIDE",
      "JS_SHORT_GAP",
      "JS_YIELD_MISSED",
      "LL_MOCK_BELOW_PASS",
      "LL_OVERCONFIDENT",
      "LL_SIGN_FAMILY_CONFUSION",
      "LL_TIMEOUTS",
      "LL_UNDERCONFIDENT",
      "LL_WEAK_TOPIC",
      "NAZ_BELOW_KERALA_MARK",
      "NAZ_COMM_MISSED_MENTION",
      "NAZ_EARLY_TAPS",
      "NAZ_FALSE_ALARMS",
      "NAZ_IMPROVED",
      "NAZ_LATE_RESPONSE",
      "NAZ_MISSED_HAZARD",
      "NAZ_OVERCONFIDENT",
      "NAZ_PATTERN_CLICK",
      "NAZ_REPEATED_TYPE_MISS",
      "NG_FOG_HIGH_BEAM",
      "NG_GLARE_NO_LEFT_EDGE",
      "NG_HIGH_BEAM_ONCOMING",
      "NG_HIT_UNLIT",
      "NG_OUTRIDING_LIGHTS",
      "SD_COLLISION",
      "SD_OVERSPEED_FOR_SIGHT",
      "SD_SPEED_CHOICE_GOOD",
      "SD_UNDERESTIMATE",
      "SD_WET_GAP",
      "TT_CONE_HIT",
      "TT_FOOT_DOWN",
      "TT_IMMEDIATE_FAIL",
      "TT_LINE_TOUCH",
      "TT_OVER_TIME",
      "TT_ROLLBACK"
    ],
    "rule_ids": [],
    "drill_ids": [
      "DR-BS-MIRROR",
      "DR-BS-PLACE",
      "DR-BS-RIDE",
      "DR-BS-RIDE-LEFTTURN",
      "DR-HF-ISI",
      "DR-HF-PILLION",
      "DR-HF-STRAP",
      "DR-HR-BENDS",
      "DR-HR-GEAR",
      "DR-HR-TRIP",
      "DR-HR-YIELD",
      "DR-JS-CREEP",
      "DR-JS-GAP",
      "DR-JS-SCAN",
      "DR-JS-YIELD",
      "DR-LL-CALIB",
      "DR-LL-MOCK",
      "DR-LL-SIGNS-CAUTIONARY",
      "DR-LL-SIGNS-INFORMATORY",
      "DR-LL-SIGNS-MANDATORY",
      "DR-LL-SIGNS-MARKINGS",
      "DR-LL-SIGNS-SIGNALS",
      "DR-LL-TOPIC-LL1",
      "DR-LL-TOPIC-LL2",
      "DR-LL-TOPIC-LL3",
      "DR-LL-TOPIC-LL4",
      "DR-NAZ-CALM",
      "DR-NAZ-COMM",
      "DR-NAZ-MOCK",
      "DR-NAZ-OCCL-AUTO_CUT_IN",
      "DR-NAZ-OCCL-BUS_STOP_PEDESTRIAN",
      "DR-NAZ-OCCL-CATTLE_ANIMAL",
      "DR-NAZ-OCCL-CHILD_SCHOOL",
      "DR-NAZ-OCCL-CYCLIST",
      "DR-NAZ-OCCL-DOOR_OPENING",
      "DR-NAZ-OCCL-JUNCTION_EMERGING",
      "DR-NAZ-OCCL-OTHER",
      "DR-NAZ-OCCL-OVERTAKING_ONCOMING",
      "DR-NAZ-OCCL-PARKED_VEHICLE_HIDDEN",
      "DR-NAZ-OCCL-PEDESTRIAN_MEDIAN",
      "DR-NAZ-OCCL-SURFACE_HAZARD",
      "DR-NAZ-OCCL-TRUCK_LEFT_TURN",
      "DR-NAZ-OCCL-VEHICLE_PULLING_OUT",
      "DR-NAZ-OCCL-WRONG_SIDE_2W",
      "DR-NAZ-QUIET",
      "DR-NG-DIP",
      "DR-NG-FOG",
      "DR-NG-GLARE",
      "DR-NG-RANGE",
      "DR-SD-PREDICT",
      "DR-SD-PREDICT-WET",
      "DR-SD-SIGHT-DRY",
      "DR-SD-SIGHT-WET",
      "DR-SD-STREET",
      "DR-TT-FIG8-SLOW",
      "DR-TT-FIG8-WIDE",
      "DR-TT-GRADIENT",
      "DR-TT-REVPARK",
      "DR-TT-TIMED"
    ],
    "fact_keys": {
      "BS_LEFT_OVERTAKE": ["truck_signal", "vehicle_type"],
      "BS_NOZONE_TIME": ["share_pct", "vehicle_type"],
      "BS_NO_HOLD_BACK": ["held_back", "left_turn_events"],
      "BS_NO_MIRROR_CHECK": ["lane_changes", "mirror_before_pct"],
      "BS_PLACEMENT_WRONG": ["probe_label", "probes_wrong"],
      "HF_ISI_CONFUSION": ["quiz_wrong_families"],
      "HF_PILLION_GAP": ["wrong"],
      "HF_STEPS_OUT_OF_ORDER": ["steps_done"],
      "HF_STRAP_STEP_SKIPPED": ["step"],
      "HR_BEND_OVERTAKE": ["bend_overtakes"],
      "HR_BRAKE_FADE": ["brake_heat_peak_pct", "gear_low_pct"],
      "HR_NO_HORN_BLIND": ["horn_missed"],
      "HR_NO_YIELD_UPHILL": ["encounters", "yield_missed"],
      "HR_OFF_EDGE": ["bend_ordinal"],
      "HR_STOP_UNDER_SLOPE": [],
      "HR_TRIP_PLAN_GAP": ["trip_plan_parts"],
      "JS_COLLISION": ["gap_s", "threat_side"],
      "JS_NOT_RIGHT_LAST": ["last_look"],
      "JS_NO_CREEP": ["occluded"],
      "JS_NO_SCAN_THREAT_SIDE": ["last_look", "threat_side"],
      "JS_SHORT_GAP": ["gap_s"],
      "JS_YIELD_MISSED": ["yield_missed"],
      "LL_MOCK_BELOW_PASS": ["correct", "format_source", "pass_mark", "total"],
      "LL_OVERCONFIDENT": ["brier", "overconfidence", "wrong_at_100"],
      "LL_SIGN_FAMILY_CONFUSION": ["sign_family", "wrong"],
      "LL_TIMEOUTS": ["per_q_timer_s", "timeouts"],
      "LL_UNDERCONFIDENT": ["accuracy_pct_50"],
      "LL_WEAK_TOPIC": ["mastery_pct", "topic"],
      "NAZ_BELOW_KERALA_MARK": ["kerala_status", "pass_mark", "score_total"],
      "NAZ_COMM_MISSED_MENTION": ["count", "hazard_type"],
      "NAZ_EARLY_TAPS": ["early_taps"],
      "NAZ_FALSE_ALARMS": ["fa_per_min"],
      "NAZ_IMPROVED": ["gain_m", "gain_s"],
      "NAZ_LATE_RESPONSE": ["clip_ordinal", "hazard_type", "late_s", "metres", "speed_kmh"],
      "NAZ_MISSED_HAZARD": ["clip_ordinal", "hazard_type", "missed_count"],
      "NAZ_OVERCONFIDENT": ["actual_pass", "predicted_pass"],
      "NAZ_PATTERN_CLICK": ["pattern_clips", "taps_in_1s"],
      "NAZ_REPEATED_TYPE_MISS": ["hazard_type", "times"],
      "NG_FOG_HIGH_BEAM": [],
      "NG_GLARE_NO_LEFT_EDGE": ["glare_hold_pct"],
      "NG_HIGH_BEAM_ONCOMING": ["dist_m", "events"],
      "NG_HIT_UNLIT": ["hazard_type"],
      "NG_OUTRIDING_LIGHTS": ["beam", "chosen_kmh", "max_safe_kmh", "sight_m"],
      "SD_COLLISION": ["child_m", "impact_band", "rt_s", "speed_kmh", "stop_m"],
      "SD_OVERSPEED_FOR_SIGHT": ["chosen_kmh", "max_safe_kmh", "over_kmh", "sight_m", "surface"],
      "SD_SPEED_CHOICE_GOOD": ["sight_m"],
      "SD_UNDERESTIMATE": ["error_pct", "predicted_m", "speed_kmh", "surface", "true_m"],
      "SD_WET_GAP": ["dry_err_pct", "wet_err_pct"],
      "TT_CONE_HIT": ["count", "fault_location"],
      "TT_FOOT_DOWN": ["count", "fault_location"],
      "TT_IMMEDIATE_FAIL": ["fault", "fault_location"],
      "TT_LINE_TOUCH": ["count", "fault_location"],
      "TT_OVER_TIME": ["time_limit_s", "time_s"],
      "TT_ROLLBACK": ["rollback_cm"]
    }
  },
  "tutor_agent": {
    "explanation_ids": [],
    "rule_ids": []
  },
  "voice_guide_agent": {
    "get_rule_ids": [],
    "open_drill_ids": [
      "DR-BS-MIRROR",
      "DR-BS-PLACE",
      "DR-BS-RIDE",
      "DR-BS-RIDE-LEFTTURN",
      "DR-GH-MYTHS",
      "DR-GH-ORDER",
      "DR-HF-ISI",
      "DR-HF-PILLION",
      "DR-HF-STRAP",
      "DR-JS-CREEP",
      "DR-JS-GAP",
      "DR-JS-SCAN",
      "DR-JS-YIELD",
      "DR-LL-CALIB",
      "DR-LL-MOCK",
      "DR-LL-SIGNS-CAUTIONARY",
      "DR-LL-SIGNS-INFORMATORY",
      "DR-LL-SIGNS-MANDATORY",
      "DR-LL-SIGNS-MARKINGS",
      "DR-LL-SIGNS-SIGNALS",
      "DR-LL-TOPIC-LL1",
      "DR-LL-TOPIC-LL2",
      "DR-LL-TOPIC-LL3",
      "DR-LL-TOPIC-LL4",
      "DR-NAZ-CALM",
      "DR-NAZ-COMM",
      "DR-NAZ-MOCK",
      "DR-NAZ-OCCL-AUTO_CUT_IN",
      "DR-NAZ-OCCL-BUS_STOP_PEDESTRIAN",
      "DR-NAZ-OCCL-CATTLE_ANIMAL",
      "DR-NAZ-OCCL-CHILD_SCHOOL",
      "DR-NAZ-OCCL-CYCLIST",
      "DR-NAZ-OCCL-DOOR_OPENING",
      "DR-NAZ-OCCL-JUNCTION_EMERGING",
      "DR-NAZ-OCCL-OTHER",
      "DR-NAZ-OCCL-OVERTAKING_ONCOMING",
      "DR-NAZ-OCCL-PARKED_VEHICLE_HIDDEN",
      "DR-NAZ-OCCL-PEDESTRIAN_MEDIAN",
      "DR-NAZ-OCCL-SURFACE_HAZARD",
      "DR-NAZ-OCCL-TRUCK_LEFT_TURN",
      "DR-NAZ-OCCL-VEHICLE_PULLING_OUT",
      "DR-NAZ-OCCL-WRONG_SIDE_2W",
      "DR-NAZ-QUIET",
      "DR-SD-PREDICT",
      "DR-SD-PREDICT-WET",
      "DR-SD-SIGHT-DRY",
      "DR-SD-SIGHT-WET",
      "DR-SD-STREET",
      "DR-TT-FIG8-SLOW",
      "DR-TT-FIG8-WIDE",
      "DR-TT-TIMED"
    ]
  },
  "coach_agent": {
    "drill_ids": [
      "DR-BS-MIRROR",
      "DR-BS-PLACE",
      "DR-BS-RIDE",
      "DR-BS-RIDE-LEFTTURN",
      "DR-GH-MYTHS",
      "DR-GH-ORDER",
      "DR-HF-ISI",
      "DR-HF-PILLION",
      "DR-HF-STRAP",
      "DR-JS-CREEP",
      "DR-JS-GAP",
      "DR-JS-SCAN",
      "DR-JS-YIELD",
      "DR-LL-CALIB",
      "DR-LL-MOCK",
      "DR-LL-SIGNS-CAUTIONARY",
      "DR-LL-SIGNS-INFORMATORY",
      "DR-LL-SIGNS-MANDATORY",
      "DR-LL-SIGNS-MARKINGS",
      "DR-LL-SIGNS-SIGNALS",
      "DR-LL-TOPIC-LL1",
      "DR-LL-TOPIC-LL2",
      "DR-LL-TOPIC-LL3",
      "DR-LL-TOPIC-LL4",
      "DR-NAZ-CALM",
      "DR-NAZ-COMM",
      "DR-NAZ-MOCK",
      "DR-NAZ-OCCL-AUTO_CUT_IN",
      "DR-NAZ-OCCL-BUS_STOP_PEDESTRIAN",
      "DR-NAZ-OCCL-CATTLE_ANIMAL",
      "DR-NAZ-OCCL-CHILD_SCHOOL",
      "DR-NAZ-OCCL-CYCLIST",
      "DR-NAZ-OCCL-DOOR_OPENING",
      "DR-NAZ-OCCL-JUNCTION_EMERGING",
      "DR-NAZ-OCCL-OTHER",
      "DR-NAZ-OCCL-OVERTAKING_ONCOMING",
      "DR-NAZ-OCCL-PARKED_VEHICLE_HIDDEN",
      "DR-NAZ-OCCL-PEDESTRIAN_MEDIAN",
      "DR-NAZ-OCCL-SURFACE_HAZARD",
      "DR-NAZ-OCCL-TRUCK_LEFT_TURN",
      "DR-NAZ-OCCL-VEHICLE_PULLING_OUT",
      "DR-NAZ-OCCL-WRONG_SIDE_2W",
      "DR-NAZ-QUIET",
      "DR-SD-PREDICT",